<?xml version="1.0" encoding="UTF-8"?>
<!DOCTYPE schema SYSTEM "libgda-ddl-creator.dtd">
<schema name="libgda">
  <table name="products" temptable="TRUE">
    <comment>Some comment about table goes here</comment>
    <column name="column_name" type="string" pkey="TRUE" 
            unique="TRUE" autoinc="FALSE" nnul="FALSE">
        <comment>Some column description</comment>
        <size>5</size>
        <default>0</default>
    </column>
    <fkey reftable="products" onupdate="NO_ACTION" ondelete="NO_ACTION">
      <fk_field name="column_name" reffield="column_name"/>
    </fkey>
  </table>
  <view name="MyView" replace="TRUE" temp="FALSE" ifnotexists="TRUE">
    <definition>SELECT * FROM products</definition>
  </view>
</schema>

